{
  "providers": {
    "gcp": {
      "project_id": "project-8888321c-54a9-4dac-86d",
      "region": "us-central1",
      "zone": "us-central1-a"
    },
    "aws": {
      "region": "us-east-1"
    },
    "azure": {
      "subscription_id": "38201a58-67d5-4800-940c-3aff3caa9451",
      "location": "westeurope",
      "resource_group_name": "coinops-learning-rg"
    }
  },
  "environment": "learning",
  "default_os": "debian-12",
  "default_machine_type": "small",
  "default_disk_size_gb": 10,
  "default_disk_type": "standard",
  "ssh_user": "terraform",
  "ssh_port": 47832
}